{
  "schemaVersion": 1,
  "id": "dark",
  "label": "深色主题",
  "dark": true,
  "overrides": {
    "color.background": "#141517",
    "color.surface": "#1c1e21",
    "color.primary": "#83b2f2",
    "color.primary-soft": "#213a5c",
    "color.on-primary": "#17181a",
    "color.action": "#f1f3f4",
    "color.action-soft": "#2a2c30",
    "color.on-action": "#17181a",
    "color.secondary": "#a9afb7",
    "color.secondary-soft": "#292c30",
    "color.border": "#34383e",
    "color.error": "#d47a73",
    "color.error-soft": "#3b2928",
    "color.info": "#79aee0",
    "color.success": "#7fb197",
    "color.success-soft": "#21342b",
    "color.warning": "#d0ad62",
    "color.warning-soft": "#372f20",
    "color.on-surface": "#f2f3f5",
    "color.on-surface-muted": "#a9afb7",
    "color.surface-variant": "#24272b",
    "color.surface-raised": "#292c30",
    "color.on-background": "#f2f3f5",
    "color.on-secondary": "#17181a",
    "color.outline": "#747a83",
    "color.divider": "#303338",
    "color.disabled": "#737981",
    "color.scrim": "#050607c2",
    "color.on-error": "#17181a",
    "color.on-success": "#17181a",
    "color.on-warning": "#17181a",
    "color.on-info": "#17181a",
    "elevation.card": "0 1px 2px rgba(0, 0, 0, 0.35), 0 10px 28px rgba(0, 0, 0, 0.28)",
    "elevation.raised": "0 6px 18px rgba(0, 0, 0, 0.4), 0 18px 40px rgba(0, 0, 0, 0.32)",
    "elevation.level-1": "0 1px 3px rgba(0, 0, 0, 0.35)",
    "elevation.level-2": "0 4px 10px rgba(0, 0, 0, 0.4)",
    "elevation.level-3": "0 8px 20px rgba(0, 0, 0, 0.45)",
    "elevation.level-4": "0 14px 32px rgba(0, 0, 0, 0.5)",
    "elevation.level-5": "0 22px 48px rgba(0, 0, 0, 0.58)"
  }
}
